{
  "$schema": "https://json-schema.org/draft/2020-12/schema",
  "$id": "https://aveproject.org/schema/crosswalk-1.0.0.schema.json",
  "title": "AVE Crosswalk",
  "description": "AVE (the behavioral vulnerability enumeration standard for agentic AI components) — a mapping between AVE and one other taxonomy, scanner, or standard. Schema v1.0.0. Derived from the crosswalk files already in crosswalks/: the required set is what every one of them carries, and the shared vocabulary below is typed where every file that uses a name uses it the same way. A crosswalk is a bespoke document about one pair of taxonomies, so per-pair keys are permitted throughout and are not enumerated here.",
  "type": "object",
  "additionalProperties": true,
  "required": [
    "$schema",
    "source",
    "target",
    "generated",
    "note",
    "mappings",
    "coverage"
  ],
  "properties": {
    "$schema": {
      "type": "string",
      "pattern": "^https://aveproject\\.org/schema/crosswalk-[0-9]+\\.[0-9]+\\.[0-9]+\\.schema\\.json$",
      "description": "The versioned crosswalk schema this file was authored against.",
      "examples": [
        "https://aveproject.org/schema/crosswalk-1.0.0.schema.json"
      ]
    },
    "source": {
      "$ref": "#/$defs/endpoint",
      "description": "The side the mapping reads from. For a crosswalk named X-to-AVE this is X; for AVE-to-X it is AVE."
    },
    "target": {
      "$ref": "#/$defs/endpoint",
      "description": "The side the mapping reads into."
    },
    "generated": {
      "type": "string",
      "format": "date",
      "pattern": "^[0-9]{4}-[0-9]{2}-[0-9]{2}$",
      "description": "ISO 8601 date this crosswalk's contents were last derived, e.g. 2026-07-25. The pattern is stated alongside the format keyword deliberately: format is an annotation a validator may ignore, and a date that does not parse is the failure this field exists to prevent."
    },
    "note": {
      "type": "string",
      "description": "What this crosswalk maps, what it deliberately does not, and the reading of the other taxonomy it assumes. This is the field a reader consults before trusting a row."
    },
    "revision_note": {
      "type": "string",
      "description": "What changed since the previous revision of this file, including any category the other side renamed or retitled. Optional."
    },
    "mappings": {
      "type": "array",
      "minItems": 1,
      "description": "One entry per correspondence. The entry shape is per-crosswalk — a scanner crosswalk keys on its rule ids, a taxonomy crosswalk keys on category ids — so only the names shared across existing files are typed below.",
      "items": {
        "$ref": "#/$defs/mapping"
      }
    },
    "gaps": {
      "type": "array",
      "description": "Correspondences that do not exist, each with the reason. A crosswalk that lists only what matched overstates its own coverage. Optional.",
      "items": {
        "$ref": "#/$defs/gap"
      }
    },
    "coverage": {
      "type": "object",
      "minProperties": 1,
      "description": "How much of each side the mappings account for. The counter names are per-crosswalk because the countable units differ (categories, rules, patterns, records), so this is an open object of counts, with room for one prose value explaining what the counts leave out.",
      "additionalProperties": {
        "type": [
          "integer",
          "string"
        ],
        "minimum": 0
      }
    }
  },
  "$defs": {
    "ave_id": {
      "type": "string",
      "pattern": "^AVE-[0-9]{4}-[0-9]{5}$",
      "description": "An AVE record identifier, in the format AVE-YYYY-NNNNN defined by the record schema."
    },
    "endpoint": {
      "type": "object",
      "additionalProperties": true,
      "required": [
        "url"
      ],
      "description": "One side of the mapping. Only url is universal across existing crosswalks; the rest of an endpoint's description depends on what the side is — a standard has a version and a record count, a scanner has a vendor, a licence, and a rule total. An endpoint is in exactly one of three states with respect to pinning: it carries commit, in which case a stated count can be re-derived; or it carries pin_status unpinnable, in which case it says so and carries what it has instead; or it carries neither, which is not a statement about the side at all, only that nobody has pinned it yet. The three are distinguishable because the second is a declaration a reader can audit and the third is a blank.",
      "if": {
        "properties": {
          "pin_status": {
            "const": "unpinnable"
          }
        },
        "required": [
          "pin_status"
        ]
      },
      "then": {
        "required": [
          "unpinnable_reason",
          "checked_against_live_site",
          "content_digest"
        ],
        "not": {
          "required": [
            "commit"
          ]
        }
      },
      "allOf": [
        {
          "$comment": "An endpoint that STATES a record count must say which commit the count was read at, so the number can be re-derived rather than taken on trust. Scoped to count-stating endpoints because an endpoint that states no count has nothing to re-derive. The `not` clause is load-bearing: without it this rule and the unpinnable rule above are jointly unsatisfiable for a side that declares itself unpinnable AND states a count, because one demands commit and the other forbids it, which would silently delete one of the three pinning states this endpoint's own description defines.",
          "if": {
            "required": [
              "record_count"
            ],
            "not": {
              "properties": {
                "pin_status": {
                  "const": "unpinnable"
                }
              },
              "required": [
                "pin_status"
              ]
            }
          },
          "then": {
            "required": [
              "commit"
            ]
          }
        }
      ],
      "properties": {
        "url": {
          "type": "string",
          "format": "uri",
          "pattern": "^https?://",
          "description": "Canonical URL for this side: its project site, specification, or repository. As with generated, the pattern sits beside the format keyword because format is an annotation unless the validator is run with format checking on, and jsonschema's uri checker additionally needs the rfc3986-validator package installed. The pattern holds either way."
        },
        "standard": {
          "type": "string",
          "description": "Name of the standard, when this side is one. Optional."
        },
        "tool": {
          "type": "string",
          "description": "Name of the tool, when this side is one. Optional."
        },
        "vendor": {
          "type": "string",
          "description": "Who publishes the tool. Optional."
        },
        "license": {
          "type": "string",
          "description": "SPDX identifier for the tool's licence, e.g. Apache-2.0. Optional."
        },
        "version": {
          "type": "string",
          "description": "Version of the standard or tool this crosswalk was read against. Optional."
        },
        "record_count": {
          "type": "integer",
          "minimum": 0,
          "description": "Number of AVE records this side carried when the crosswalk was derived. Meaningful only alongside commit, or alongside a pin_status of unpinnable and the date and digest that go with it: a count on its own cannot be re-derived, because the corpus it counts keeps moving. Optional."
        },
        "commit": {
          "type": "string",
          "pattern": "^[0-9a-f]{40}$",
          "description": "Full 40-character commit sha pinning the tree this side was read at, and therefore the tree any record_count or rule total stated here describes. It is whichever tree was actually read, not the tip of any particular branch: a pin naming a tree the count did not come from validates, reads as clean, and produces a different number for anyone who checks, which is worse than no pin at all. Optional, and the field a stale count is diagnosed with: a crosswalk stating a record count and a read date, with no commit, cannot be checked by a reader without re-counting the upstream tree by hand. Full rather than abbreviated, because an abbreviation that is unique today is not guaranteed to stay unique in a growing repository. A sha on a branch that is later rebased away stops resolving, and a pin that no longer resolves should fail; that is the validator's problem, not this schema's."
        },
        "pin_status": {
          "const": "unpinnable",
          "description": "Present only to declare that this side has no git history to pin, so that a reader can tell a stated exemption from a field nobody has filled in yet. unpinnable is the only permitted value: an endpoint carrying commit is already pinned and a second field restating that would be a second answer to one question. An endpoint declaring it must also carry unpinnable_reason and checked_against_live_site, must not carry commit, and is checked: a side that declares itself unpinnable and turns out to have a resolvable repository fails, because a declaration that can never be checked is not a declaration. Optional."
        },
        "unpinnable_reason": {
          "type": "string",
          "minLength": 1,
          "description": "Why this side cannot be pinned, in terms a reader can check — a published site with no repository behind it, a distribution with no public source, a vendor page. Required when pin_status is unpinnable. 'Difficult to find' is not one of these; the reason is what stops unpinnable becoming the box anything awkward gets put in."
        },
        "content_digest": {
          "type": "string",
          "pattern": "^sha256:[0-9a-f]{64}$",
          "description": "Lowercase sha256, prefixed sha256:, of the bytes fetched from url on the date in checked_against_live_site. Required when pin_status is unpinnable, where it is the nearest thing an unpinnable side has to a pin: it does not let a reader re-derive a count, but it does let them tell whether the page has moved since it was read. Optional otherwise."
        },
        "checked_against_live_site": {
          "type": "string",
          "format": "date",
          "pattern": "^[0-9]{4}-[0-9]{2}-[0-9]{2}$",
          "description": "ISO 8601 date the other side's published site content was last verified, where that side has no repository to pin. Distinct from generated: this crosswalk's rows may have been re-derived more recently than the descriptions they were matched against. Required when pin_status is unpinnable, where it is the date half of that declaration — this field already means the date a side with no repository was read, so no second fetch-date field is defined. Optional otherwise."
        }
      }
    },
    "mapping": {
      "type": "object",
      "minProperties": 1,
      "additionalProperties": true,
      "description": "One correspondence. Per-crosswalk keys naming the other side's unit (a rule id, a category, a module) are expected and unconstrained; the names below are shared across existing crosswalks and are typed so that a malformed AVE identifier fails here rather than downstream.",
      "properties": {
        "ave_id": {
          "$ref": "#/$defs/ave_id",
          "description": "The AVE record this entry maps to, when exactly one does."
        },
        "ave_ids": {
          "type": "array",
          "description": "Every AVE record this entry maps to, when more than one does.",
          "items": {
            "$ref": "#/$defs/ave_id"
          }
        },
        "primary_ave_id": {
          "oneOf": [
            {
              "$ref": "#/$defs/ave_id"
            },
            {
              "type": "null"
            }
          ],
          "description": "The closest single AVE record, where ave_ids lists several. Explicitly null when no one record is closest, which is a different statement from omitting the field."
        },
        "description": {
          "type": "string",
          "description": "What the other side's unit covers, in its own terms."
        },
        "notes": {
          "type": "string",
          "description": "How the correspondence was judged, and what it does not carry across."
        },
        "gap": {
          "type": "string",
          "description": "What this entry maps only partially, and what is left uncovered."
        }
      }
    },
    "gap": {
      "type": "object",
      "minProperties": 1,
      "additionalProperties": true,
      "description": "One correspondence that does not exist. The key naming the other side's unmapped unit is per-crosswalk; ave_id and the reason are shared.",
      "properties": {
        "ave_id": {
          "$ref": "#/$defs/ave_id",
          "description": "The AVE record that has no counterpart on the other side."
        },
        "reason": {
          "type": "string",
          "description": "Why no correspondence exists. A gap without a reason is indistinguishable from an omission."
        },
        "note": {
          "type": "string",
          "description": "Further detail on the gap."
        }
      }
    }
  }
}
